"id"	"UID"	"SCHID"	"Title"	"Title_en"	"keywords_en"	"keywords_fr"	"authors"	"date"	"langue"	"translated"	"numciting"	"numcited"
"23530"	"T0925"	""	"De la gouvernance à la gouvernance territoriale : enjeu de l’européanisation de l’aménagement du territoire. Réflexions à partir d’une recherche dans le cadre de l’Observatoire en réseau de l’aménagement du territoire européen (ORATE)"	"Governance in the field of European spatial planning: europeanization at stake. Proposals for an analysis in the framework of the European Spatial Observatory Network (ESPON)."	";europeanization;gouvernance;territorial governance;European Spatial Observatory Network (ESPON);Union européenne;spatial concept;spatial planning;Observatoire en réseau de l’aménagement du territoire européen (ORATE);European Union;aménagement du territoire;gouvernance territoriale;européanisation;governanc"	"aménagement du territoire,européanisation,gouvernance,gouvernance territoriale,Observatoire en réseau de l’aménagement du territoire européen (ORATE),Union européenne"	";Emmanuelle , Bonerandi;Frédéric , Santamaria"	"2011-03-18"	"fr"	"true"	"0"	"12"
"194"	"T0234"	"14257865210444486682"	"Cognitive and cartographic representations : towards a comprehensive approach"	""	";textual analysis;techniques d'enquête;spatial learning;carte à main levée;comparaison de cartes;survey technics;cognition spatiale;Cognitive representation;régression bi-dimensionnelle;spatial knowledge;représentation cognitive;apprentissage spatial;bidimensional regression;cartographic comparison;analyse textuelle;spatial cognition;sketch ma"	"régression bi-dimensionnelle,comparaison de cartes,représentation cognitive,carte à main levée,cognition spatiale,apprentissage spatial,techniques d'enquête,analyse textuelle"	";Colette , Cauvin"	"2002-01-15"	"en"	"false"	"0"	"66"
"1965"	"T0012"	"9307607782411909849"	"Espace agricole périurbain et politiques communales d’aménagement :L’exemple de l’agglomération albigeoise"	"Periurban agriculture and municipal land planning : the case of the Albi agglomeration"	";multifonctionnalité de l’agriculture;agricultural multifunctionality;urban sprawl;periurban agriculture;périurbanisation;commune;land management;agriculture périurbaine;municipality;aménagement du territoir"	"agriculture périurbaine,aménagement du territoire,commune,multifonctionnalité de l’agriculture,périurbanisation"	";Isabelle , Duvernoy"	"2002-03-05"	"fr"	"true"	"0"	"29"
"25954"	"T1097"	""	"La logique ternaire de Stéphane Lupasco et le raisonnement géocartographique bioculturel d’Homo geographicus"	"The ternary logic of Stephane Lupasco and the biocultural geocartographic reasoning of Homo geographicus: the contribution of the concept of transdisciplinary coupling to the study of morphological aggregation of urban agglomerations."	";Couplage;Système de villes;Geocartography;Aggregation;Agrégation;System of Cities;Logique ternaire antagoniste;Ecological Footprint;Empreinte écologique;Coupling;Memory;Antagonistic Ternary Logic;Transdisciplinarity;Lotka-Volterra Model;Modèle de Lotka-Volterra;Energy;Allométrie;Allometry;Géocartographie;Transdisciplinarité;Mémoire;Energi"	"Allométrie,Agrégation,Couplage,Empreinte écologique,Energie,Géocartographie,Logique ternaire antagoniste,Modèle de Lotka-Volterra,Mémoire,Système de villes,Transdisciplinarité"	";Henri , Reymond;Colette , Cauvin"	"2013-06-28"	"fr"	"true"	"0"	"83"
"22232"	"T0801"	"6096114211561939571"	"Espaces à risque et marges : méthodes d’approche des vulnérabilités urbaines à Lima et Quito"	""	";geopolitical studies;stigma;analyse géopolitique;development stake;accident;enjeux de développement;deprived area;marge;Quito;territorialiation;Lima;epistemology;urban vulnerability;vulnérabilité urbaine;risk;accidents;stigmates;risque;épistémologie;territorialisatio"	"accidents,analyse géopolitique,enjeux de développement,épistémologie,Lima,marge,Quito,risque,stigmates,vulnérabilité urbaine,territorialiation"	";Alexis , Sierra"	"2009-05-14"	"fr"	"false"	"0"	"33"
"18082"	""	""	"Révision de l'atlas Polmar-Terre du Département de la Manche : vers un SIG opérationnel interservices"	"Updating a Marine pollution sensitivity atlas : towards an operational coastal GIS for the French administrations (the case of the Département de la Manche)"	";Département de la Manche;Marine Pollution;MIMEL;Sensitivity Index;Marine Spatial Data Infrastructure;indice de sensibilité;Coastal Zone;SIG;Pôle géomatique marin;pollution marine accidentelle;littoral;atlas Polmar-Terre;Polmar-Terre Atlas;GI"	"atlas Polmar-Terre,SIG,indice de sensibilité,pollution marine accidentelle,littoral,Département de la Manche,Pôle géomatique marin,MIMEL"	";Frédéric , Quemmerais;Iwan , Le Berre;Bernard , Fichaut"	"2008-05-06"	""	"true"	"0"	"24"
"2978"	"T0105"	"9074180508714334781"	"Les vitesses dans l’aire urbaine dijonnaise : un modèle fondé sur la fonction logistique et la courbe de congestion routière débit-vitesse"	"Speeds in Dijon urban area : a model based on the logistic function and the curve of road congestion flow-speed"	";modèle débit-vitesse;aire urbaine dijonnaise;speed;logistic model;modèle logistique;flow-speed model;road density;vitesse;Greenshields;Dijon urban are"	"aire urbaine dijonnaise,Greenshields,modèle débit-vitesse,modèle logistique,vitesse"	";Cyril , Enault"	"2005-12-01"	"fr"	"true"	"0"	"38"
"869"	""	"3270115123307017782"	"Le Bras H., 2000, <em>Essai de géométrie sociale</em>, Paris, Editions Odile Jacob."	""	""	""	";Anne , Bretagnolle"	"2002-05-22"	"fr"	"false"	"0"	"0"
"24792"	"T0959"	"4815111759939276934"	"Le Nord du Chili : un isolat énergétique dans un désert minier"	"The North of Chile: an energy island in a mining desert"	";organización espacial;Chili;Chile;réseaux énergétiques;energy networks;organisation spatiale;redes energéticas;intégration macro-régionale;energía;énergie;macro-regional integration;spatial organization;integración macro regional;energ"	"énergie,organisation spatiale,réseaux énergétiques,intégration macro-régionale,Chili"	";Silvina Cecilia , Carrizo;Sébastien , Velut;Jimena , Hevia"	"2011-11-22"	"Résum"	"true"	"0"	"32"
"26957"	""	"872891991941436848"	"Adapting the model of scientific publishing"	"Adapting the model of scientific publishing"	""	""	";Denise , Pumain"	"2015-05-06"	""	"true"	"0"	"0"
"716"	"T0461"	"7192494315482931396"	"Processus de croissance et limites urbaines"	"Growth process and urban limits"	";télédétection;remote sensin"	"télédétection"	";Christiane , Weber;Jacky , Hirsch"	"2000-04-25"	"fr"	"true"	"0"	"3"
"26921"	""	"668349723855649886"	"Géographie d’une maladie émergente en milieu urbain endémique, le cas de la dengue à Delhi, Inde"	"Geography of an emerging disease in endemic urban milieu: the case of dengue in Delhi"	";spatial analysis;maladie ré-émergente;re-emerging disease;diffusion spatio-temporelle;urban area;analyse spatiale;spatio-temporal diffusion;ville;dengu"	"dengue,maladie ré-émergente,diffusion spatio-temporelle,ville,analyse spatiale"	";Olivier , Telle"	"2015-04-07"	"fr"	"true"	"0"	"57"
"11133"	"T0542"	"16058868812392252316"	"The storm that rocks the boat: the systemic impact of gated communities on urban sustainability"	""	";communauté fermée;gated communities;impact assessment;approche systémique;sustainable development;soutenabilité urbaine;systemic approach;systems thinking;urban sustainabilit"	"soutenabilité urbaine,communauté fermée,approche systémique"	";Karina , Landman"	"2007-09-19"	"En"	"false"	"0"	"15"
"5265"	"T0519"	"4891674481642080428"	"Evaluation of natural surfaces in a dry tropical environment by remote sensing and ground survey "	""	";ground survey;inventaire d'occupation du sol;land cover inventory;estimation de superficie;Mauritanie;télédétection;sondages aréolaires;Mauritania;estimation of area;area frame sampling;remote sensing;enquête de terrai"	"enquête de terrain,estimation de superficie,inventaire d'occupation du sol,Mauritanie,sondages aréolaires,télédétection"	";Vincent , Godard"	"1996-12-17"	"fr"	"false"	"0"	"17"
"22165"	"T0796"	"9473618089176112264"	"Les espaces du vote en Europe. La participation aux élections du Parlement européen de 2004"	"Voting Spaces in Europe. Studying Voter Turnout for the 2004 European Parliament Elections"	";NUTS3;carte électorale;élection européenne;Europe élargie;analyse multiscalaire;multiscalar analysis;regional typology;typologie régionale;European enlargement;electoral map;European electio"	"élection européenne,carte électorale,analyse multiscalaire,typologie régionale,Europe élargie,NUTS3"	";Emmanuelle , Boulineau;Aurélie , Delage;Hélène , Roth;Luc , Merchez"	"2009-04-07"	"fr"	"true"	"0"	"17"
"5377"	"T0469"	"4950151481194480026"	"Réalignements partisans face à la construction européenne"	""	";referendum;Europ"	"Europe,referendum"	";Jean-Paul , Gosset;Céline , Colange;Michel , Bussi"	"2005-06-03"	"fr"	"false"	"0"	"0"
"26118"	"T1122"	"18257996176964180316"	"La relation ville-fleuve-port dans les projets urbains : acteurs et instruments d’une reconnexion (Strasbourg, Lyon)"	"Urban planning projects in the river cities: the new relationships between city, river and port regarding interfaces"	";port;fleuve;ports;river cities;projets urbains;planning;aménagement;waterfront;urban projects;friche"	"projets urbains,aménagement,friches,fleuve,port"	";Jean , Debrie"	"2013-12-12"	"fr"	"true"	"0"	"27"
"10451"	"T0095"	"10485423212840714788"	"La politique des &quot;sites naturels&quot; classés dans les Pyrénées : rétrospective des applications et enjeux contemporains"	"The enforcement of the “natural sites” feature in the french Pyrenees: historical overview and survey of present stakes"	";protection des paysages;mountain;landscape protection;montagne;hydroelectricity;tourism;protection de la nature;hydroélectricité;Pyrenees;tourisme;nature conservation features;Pyrénée"	"hydroélectricité,montagne,protection de la nature,protection des paysages,Pyrénées,tourisme"	";Johan , Milian"	"2007-09-28"	"fr"	"true"	"0"	"11"
"23201"	""	"14351847275245913222"	"<em>Nourrir les hommes. Un dictionnaire</em>, 2009, Paris, Éditions Atlande, 765 p."	""	""	""	";Gabriel , Dupuy"	"2010-07-08"	"fr"	"false"	"0"	"0"
"26507"	"T1191"	""	"Crédits"	""	""	""	""	"2014-11-12"	"es"	"false"	"0"	"0"
"23273"	""	""	"Anglade G., 2008, <em>Chronique d'une espérance. L'hebdo de Georges Anglade (2007-2008),</em> Port-au-Prince, L'Imprimeur II, Collection Livres en folie, 104 p."	""	";mutations sociales;géographie du développement;pauvreté;misère;geography of development;Haiti;Haïti;social geography;social shifts;poverty;demographic transitions;transitions démographiques;géographie sociale;misery;peasan"	"géographie du développement,géographie sociale,Haïti,misère,mutations sociales,pauvreté,transitions démographiques"	";Carlo , Prévil"	"2010-09-28"	"fr"	"false"	"0"	"11"
"1435"	"T0457"	""	"L’eau convoitée de la Guyane vénézuélienne1"	"The covetous water of the Guayana – Venezuela"	";planning;pôle d’industrie lourde;hydroelectricity;hydroélectricité;décentralisation;Bas Orénoque;heavy industry pole;decentralization;Low Orinoco;planification;Ciudad Guyan"	"Bas Orénoque,hydroélectricité,pôle d’industrie lourde,planification,décentralisation"	";Anne , Pene-Annette"	"2004-12-16"	""	"true"	"0"	"0"
"22862"	"T0880"	"8229787373038521634"	"JournalBase - A Comparative International Study of Scientific Journal Databases in the Social Sciences and the Humanities (SSH)"	""	";bibliometry;humanities;social sciences;science assessmen"	""	";Denise , Pumain;Christine , Kosmopoulos;Michèle , Dassa"	"2010-01-08"	"en"	"false"	"0"	"10"
"5006"	"T0130"	"14333755945056675914"	"Les désajustements environnementaux dans la région de l’Office du Niger : évaluation et perspectives"	"Environmental disruptions in the Office of Niger area : evaluation and perspectives"	";office of Niger;élevage;fuel wood;dégradation environnementale;breeding;irrigated perimeter;bois-énergie;water management;environment degradation;gestion de l’eau;périmètre irrigué;office du Nige"	"office du Niger,périmètre irrigué,gestion de l’eau,élevage,bois-énergie,dégradation environnementale"	";Florence , Brondeau"	"2004-03-24"	""	"true"	"0"	"16"
"4195"	"T0586"	"10121767262470765240"	"Les profils de vote selon les départements"	""	";France;présidence;carte;élection;politiqu"	"élection,France,carte,présidence,politique"	";Marianne , Guérois;Malika , Madelin;Eugénie , Dumas;Céline , Vacchiani-Marcuzzo"	"2002-04-24"	"fr"	"false"	"0"	"0"
"9942"	"T0520"	"11594923009958831386"	"The Semantics of the Web"	""	""	""	";Denise , Pumain"	"2007-09-10"	"en"	"false"	"0"	"0"
"23782"	"T0955"	"6018660907435103505"	"Méthodes pour cartographier les tendances régionales de la prévalence du VIH à partir des Enquêtes Démographiques et de Santé (EDS)"	"Methods for mapping regional trends of HIV prevalence from Demographic and Health Surveys (DHS)"	";developing countries;regional trends;kernel interpolation;VIH;demographic and health surveys;interpolation;methodology;tendances régionales;méthodologie;interpolation par noyaux;HIV;pays en développement;enquêtes démographiques et de sant"	"enquêtes démographiques et de santé,interpolation,interpolation par noyaux,méthodologie,pays en développement,tendances régionales,VIH"	";Philippe , Msellati;Joseph , Larmarange;Nicolas , Méda;Roselyne , Vallo;Seydou , Yaro"	"2011-06-16"	"fr"	"true"	"0"	"35"
"17762"	"T0746"	"3381007080750599109"	"Dépendance à l’automobile, tension dans les mobilités et stratégies des ménages"	"Automobile dependency, tension in the mobilities and households strategie"	";dépendance automobile;activity pattern;localisation rationnelle;budget temps de transport;“rational locator”.;urban sprawl;travel-time budget;étalement urbain;automobile dependency;agencement des lieux de vie;automobile speed;vitesse automobil"	"agencement des lieux de vie,budget temps de transport,dépendance automobile,étalement urbain,localisation rationnelle,vitesse automobile"	";Didier , Josselin;Cyrille , Genre-Grandpierre"	"2008-04-23"	"fr"	"true"	"0"	"10"
"26112"	"T1124"	""	"L’information sur les risques majeurs à l’échelle communale"	"The disclosure information on major risks for municipalities - Distribution and analysis of the DICRIM, a poor-used preventive tool"	";risque majeur;prevention;information géographique volontaire;major risk;prévention;volunteer geographical informatio"	"risque majeur,information géographique volontaire,prévention"	";Sylvie , Servain-Courant;Johnny , Douvinet;Mathilde , Gralepois;Cyrille , Genre-Grandpierre;Rémi , Pallares;Sylvain , Rode"	"2013-12-04"	"fr"	"true"	"0"	"22"
"26499"	"T1188"	"14881506588595722170"	"Desafíos de la publicación en abierto"	""	""	""	";Denise , Pumain;Josefina Gomez , Mendoza"	"2014-10-24"	"es"	"false"	"0"	"0"
"23142"	""	"10164182703531377361"	"Kanevski M., Pozdnoukhov A. and Timonin V., 2009, <em>Machine Learning for Spatial Environmental Data : theory, applications and software</em>, EPFL Press, 2009, 377 p."	""	""	""	";Denise , Pumain"	"2010-05-14"	"fr"	"false"	"0"	"0"
"3333"	"T0080"	"13591215103203174964"	"Elections régionales 2004 : jeux d'échelles entre local, régional et national. L'enseignement des cartes de France par canton"	""	""	""	";Jean-Paul , Gosset;Céline , Colange;Michel , Bussi;Jérome , Fourquet"	"2004-03-25"	"fr"	"false"	"0"	"0"
"19423"	""	""	"Henk A.M.J. Ten Have, (dir), 2007, <em>Éthiques de l’environnement et politique internationale</em>, collection éthiques, Éditions UNESCO, 247 p."	""	""	""	";Nathalie , Blanc"	"2008-07-04"	""	"false"	"0"	"4"
"21743"	"T0785"	"10806819384588760285"	"Inland barge services and container transport: the case of the ports of Le Havre and Marseille in the European context"	""	";port;Port;network configuration;intermodal transportation;container;Réseau;transport fluvial;inland navigation;Europe;transport intermodal;conteneu"	"conteneur,Europe,transport fluvial,transport intermodal,Port,Réseau"	";Brian , Slack;Antoine , Frémont;Pierre , Franc"	"2009-02-19"	"en"	"false"	"0"	"33"
"2063"	""	""	"Une méthode d'analyse spatiale : l'association image modèle pour une approche de la &quot;durabilité&quot; du développement"	"A Method of Spatial Analysis : the Association image/model for an Approach of the Development Durability"	";spatial analysis;West Africa;rice growing;riziculture;Afrique de l'Ouest;pays côtier;coastal countries;modélisation quantitative;analyse spatiale;télédétection;remote sensing;quantitative modellin"	"analyse spatiale,modélisation quantitative,télédétection,Afrique de l'Ouest,pays côtier,riziculture"	";Annie , Cheneau-Loquay"	"1997-11-07"	"fr"	"true"	"0"	"15"
"665"	"T0328"	"13436609632166709473"	"Structures et dynamiques forestières en milieu tempéré"	"Forest structures and dynamics in moderate climate"	";télédétection;remote sensin"	"télédétection"	";B. , Julien-Laferrière;Laurent , Simon;Hélène , Geroyannis;Micheline , Hotyat;Vincent , Godard;Jean-Paul , Gilg"	"2000-05-05"	"fr"	"true"	"0"	"0"
"2823"	"T0203"	"615768415335916081"	"Climatic changes driving on floods in the Yangtze Delta, China during 1000-2002"	""	";Yangtze Delta;hydrologie;Mann-Kendall method;climate control on floods;climate changes;Chine;méthode de Mann-Kendall;Delta du Yangtze;China;clima"	"Chine,climat,Delta du Yangtze,hydrologie,méthode de Mann-Kendall"	";Tong , Jiang;Qiang , Zhang"	"2004-12-20"	"en"	"false"	"0"	"33"
"807"	""	""	"Lagnier S., 2001, <em>Sculpture et espace urbain en France. Histoire de l’instauration d’un dialogue 1951-1992</em>, Paris, L’Harmattan, coll. Logiques sociales, 291 p. ISBN 2-7475-1172-3"	""	""	""	";Eric , Boutouyrie"	"2003-11-11"	"fr"	"false"	"0"	"0"
"638"	"T0370"	""	"La Moyenne Vallée de l’Euphrate syrien : étude préliminaire pour la cartographie des états de surface et des systèmes de drainage en vue d’une analyse paléoenvironnementale"	"The Syrian Euphrate middle valley : introduction to the cartography of surface state and draining in view of a paleoenvironmental analysis"	";télédétection;remote sensin"	"télédétection"	";Ch. , Chataigner;Pierre-Gil , Salvador;Bezunesh , Tamru"	"2000-05-05"	"fr"	"true"	"0"	"6"
"3275"	"T0030"	"555256199104743189"	"Fractals in urban geography : a theoretical outline and an empirical example"	""	";non-linear dynamic;fractales;urban geography;système urbain;dynamique non-linéaire;géographie urbaine;urban system;fractals;spatial structur"	"fractales,géographie urbaine,système urbain,dynamique non-linéaire"	";Denise , Pumain;Cécile , Tannier"	"2005-04-20"	"en"	"false"	"0"	"32"
"5140"	"T0559"	"16090726899148585477"	"Infrastructures publiques et croissance des régions françaises"	"Public infrastructures and growth in French regions"	""	""	";Sylvie , Charlot;Bertrand , Schmitt"	"1999-06-16"	"fr"	"true"	"0"	"0"
"733"	"T0724"	""	"Geographers paying attention to time"	""	""	""	";Denise , Pumain"	"2003-01-12"	"en"	"false"	"0"	"0"
"6050"	"T0498"	"325288563406547269"	"Les contradictions des réformes de l'eau potable en Colombie. L'exemple de l'aire métropolitaine de Bogotá"	"The contradictions in the reforms of the water supply system in Colombia. The case of the metropolitan area of Bogota"	";réforme néolibérale;développement durable;sustainable development;neoliberal reforms;water supply system;Colombia;Colombie;eau potabl"	"Colombie,eau potable,réforme néolibérale,développement durable"	";Vincent , Gouëset"	"2004-11-15"	""	"true"	"0"	"2"
"1226"	""	"10784863627257493276"	"Modelling within a <em>self-organising</em> or a <em>microsimulation</em> framework : opposite or complementary approaches?"	""	";modélisation;auto-organisation;self-organization;micro-simulation framewor"	"auto-organisation,modélisation"	";Lena , Sanders"	"1999-03-24"	"en"	"false"	"0"	"10"
"25760"	"T1116"	"7229278094490541409"	"Reconstituting family transitions of Sahelian western Niger 1950-2000: an agent-based modelling approach in a low data context"	""	";Niger;dynamiques socio-environnementales;socio-environmental dynamics;family organisations;structures familiales;rural society;société rurale;modélisation multi-agent;Agent-based modelling;Sahe"	"Sahel,Niger,structures familiales,modélisation multi-agent,société rurale,dynamiques socio-environnementales"	";Charles L. , Bielders;Mehdi , Saqalli;Bruno , Gérard;Pierre , Defourny"	"2013-02-21"	"en"	"false"	"0"	"58"
"5156"	""	""	"Les nouvelles perspectives d'analyse spatiale des nuisances sonores. Le projet SIGAUR (Système d'Information Géographique et Acoustique URbaine)"	""	";aide à la décision en aménagement;spatial decision support;noise pollution;pollution par le bruit;GIS;SI"	"aide à la décision en aménagement,SIG,pollution par le bruit"	";Erwan , Quesseveur"	"1999-06-16"	"fr"	"false"	"0"	"0"
"24072"	""	"12729868724034378514"	"Johnston L., Longhurst R., 2010, Space, Place and Sex. Geographies of sexualities, Plymouth, Rowman & Littlefield, 194 p."	"Johnston"	""	""	";Marianne , Blidon"	"2011-10-13"	"fr"	"true"	"0"	"3"
"24658"	"T0983"	"3331299383410697009"	"PPR, urbanisation et risques d’incendie de forêt dans les Pyrénées-Orientales : méthodes, enjeux, débats"	"PPR, urbanization and forest fire risks in Pyrénées-Orientales department: methods, issues, debates"	";feu;risk management;gestion des risques;périurbanisation;forêt;Mediterranean forest;periurban area;fire;Méditerrané"	"feu,forêt,gestion des risques,Méditerranée,périurbanisation"	";Christine , Bouisset"	"2011-10-19"	"fr"	"true"	"0"	"16"
"3627"	"T0481"	"9088022647826696653"	"Passer du local au national, ou comment devient-on député sous la Restauration ?"	"From local to national scale. How becomming a Deputy during French Restoration (1830'-1840') ?"	";register;scale;public service;territory;service public;territoire;representation;national;représentation;local;échelle;registr"	"échelle,local,national,registre,représentation,service public,territoire"	";Nicolas , Verdier"	"2004-05-10"	"fr"	"true"	"0"	"0"
"1851"	"T0578"	"17946213291265202871"	"Discontinuités dans la ville l'espace des collèges de l'agglomération parisienne, 1982-1992"	"Discontinuities in the city. The space of junior secondary schools in the Paris urban area, 1982-1992"	""	""	";Jean-Christophe , François"	"1996-04-29"	"fr"	"true"	"0"	"0"
"221"	"T0399"	"5555971192450151426"	"Information sur la Géographie Théorique et Quantitative en France "	"Progresses in Theoretical and Quantitative Geography in France"	";spatial analysis;theoretical and quantitative geography;analyse spatiale;géographie théorique et quantitativ"	"géographie théorique et quantitative,analyse spatiale"	";Denise , Pumain;Céline , Rozenblat;Hélène , Mathian"	"1996-05-03"	"fr"	"true"	"0"	"0"
"298"	"T0472"	""	"Comprendre le passé : une condition essentille pour la reconstruction des villes de l’après-apartheid et la compensation des victimes"	""	""	""	";Owen , Crankshaw;Susan , Parnell"	"1996-04-12"	"fr"	"false"	"0"	"0"
"23337"	"T0899"	"38789001693523099"	"Services globaux, géographies locales : les services aux entreprises dans les métropoles de Londres et Paris"	"Global services, local geographies: producer services in London and Paris"	";ville globale;métropolisation;services aux entreprises;Paris;global city-regions;advanced producer services;Londres;Londo"	"Londres,métropolisation,Paris,services aux entreprises,ville globale"	";Ludovic , Halbert;Kathy , Pain"	"2010-11-19"	"fr"	"true"	"0"	"69"
"932"	"T0137"	"8198332692296264486"	"Espaces et cultures à Los Angeles. A propos de quatre ouvrages récents concernant les “ Latinos ”"	""	""	""	";Jérôme , Monnet"	"2001-04-05"	"fr"	"false"	"0"	"0"
"1564"	"T0552"	"8772895117541869327"	"Landscape evaluation of heterogeneous areas using fuzzy sets"	""	";logique floue;érosion;erosion;fuzzy sets;évaluation du paysage;landscape evaluatio"	"évaluation du paysage,logique floue,érosion"	";Ralf-Uwe , Syrbe"	"1998-02-05"	"en"	"false"	"0"	"8"
"275"	"T0667"	""	"Lines of sociological analysis of times policies in the city"	""	""	""	";Carmen , Belloni"	"1996-04-12"	"en"	"false"	"0"	"0"
"1075"	"T0269"	"4202760219581665753"	"Le nouveau visage de Moscou et la contribution de la municipalité à la modernisation de la ville"	"The new face of Moscow and the contribution of the municipality to the city´s modernization"	";municipalité;Moscou;municipality;cultural specificity;spécificité culturelle;modernisation;urban politic;politique urbain"	"modernisation,Moscou,municipalité,politique urbaine,spécificité culturelle"	";Olga , Vendina;Denis , Eckert"	"1999-03-10"	"fr"	"true"	"0"	"8"
"4811"	"T0191"	"14864529982901438809"	"Modélisation géomatique rétrospective des paysages par évaluation multicritères et multiobjectifs"	"Retrospective geomatic landscape modelling by multicritera evaluation and multiobjective evaluation"	";modélisation;évaluation multiobjectifs;nulti-criteria evaluation;Sistemas de Información Geográfica;paysage historique;evaluación multiobjetivo;multi-objective evaluation;modelling;modelización;paisaje histórico;historic landscape;evaluación multicriterio;GIS;SIG;évaluation multicritère"	"évaluation multicritères,évaluation multiobjectifs,modélisation,paysage historique,SIG"	";María Teresa Camacho , Olmedo;Pilar García , Martínez;Martin , Paegelow"	"2007-03-09"	"fr"	"true"	"0"	"0"
