"id"	"UID"	"SCHID"	"Title"	"Title_en"	"keywords_en"	"keywords_fr"	"authors"	"date"	"langue"	"translated"	"numciting"	"numcited"
"23183"	"T0896"	"14546795381374140628"	"Performances des modélisations déterministes d’ozone à méso-échelle et à micro-échelle dans les Alpes-Maritimes"	"Performances of the ozone determinist modellings at mesoscale and at microscale in the Alpes-Maritimes"	";validation;forecast;modelling;atmospheric pollution;meteorology;local scal"	""	";Nicolas , Martin"	"2010-06-17"	"fr"	"true"	"0"	"15"
"22447"	"T0793"	""	"OSIRIS-Multirisques : une méthode et un outil d’aide à la décision pour les communes soumises aux risques majeurs"	"OSIRIS-Multirisques: a method and decision support tool for localities exposed to major hazards"	";Local Emergency Plan;plan communal de sauvegarde;decision support;préparation de crise;multirisques;aide à la décision;multiple hazards;crisis preparatio"	"aide à la décision,multirisques,plan communal de sauvegarde,préparation de crise"	";François , Hissel;Sylvain , Aunay;Gilles , Morel;Sabrina , Démotier"	"2009-07-02"	"fr"	"true"	"0"	"25"
"4532"	"T0383"	""	"L’eau à la rencontre des territoires"	""	""	""	""	"2004-10-15"	"fr"	"false"	"0"	"0"
"25242"	"T1065"	"6062104595581281013"	"Guelton S., Navarre F., Rousseau M.-P., 2011, L’économie de l’aménagement. Une réflexion théorique au service des praticiens, Saint-Cloud, Éditions SOTECA, 252 p."	""	""	""	";Gabriel , Dupuy"	"2012-03-28"	"fr"	"false"	"0"	"0"
"23634"	"T0937"	"735173153081046844"	"Consommation d’énergie et mobilité quotidienne selon la configuration des densités dans 34 villes européennes."	"Urban spatial structure, daily mobility and energy consumption: a study of 34 European cities"	";polycentrisme;morphologie urbaine;mobilité quotidienne;soutenabilité urbaine;polycentricism;daily mobility;structure spatiale;urban sustainability;urban structure;urban morpholog"	"mobilité quotidienne,morphologie urbaine,polycentrisme,soutenabilité urbaine,structure spatiale"	";Florent , Le Néchet"	"2011-05-18"	"fr"	"true"	"0"	"61"
"22260"	"T0786"	"5114348514309083494"	"Fiscalité et territoire en France : l’Impôt sur le Revenu des Personnes Physiques (IRPP)"	"Taxation and territory in France: the Income tax (IRPP)"	";territory;cartography;cartographie;urbanisation;urbanization;revenu;retraite;wage;tax;impôt;territoire;income;salaire;pension;13/05/200"	"impôt,revenu,salaire,retraite,territoire,urbanisation,cartographie"	";Philippe , Waniez"	"2009-05-13"	"fr"	"true"	"0"	"12"
"3027"	"T0044"	""	"Potentialités de l’imagerie satellitaire Spot 5 pour la cartographie de la végétation  terrestre"	"Mapping terrestrial vegetation applying the Spot 5 satellite imagery: application to Ouessant Island (France)"	";Spot 5;photo-interprétation;cartographie;classification;photointerpretation;mapping;végétation;vegetatio"	"cartographie,classification,photo-interprétation,Spot 5,végétation"	";Laure , Sauve;Frédéric , Bioret;Françoise , Gourmelon"	"2005-11-09"	"fr"	"true"	"0"	"22"
"22145"	""	""	"Thureau-Dangin Philippe, Chaumeau Christine, Gauthe Thierry, 2008, <em>L’Atlas des atlas. Le Monde vu d’ailleurs en 200 cartes</em>, Paris, Arthaud, Courrier International."	""	""	""	";Antoine , Laporte"	"2009-04-01"	"fr"	"false"	"0"	"0"
"4110"	"T0021"	"16988925411953661149"	"Évolution et diffusion spatiale du travail frontalier en Alsace (1968-1999)"	"Evolution and spatial diffusion of cross border commuters in Alsace (1968-1999)"	";travail frontalier;spatial dynamic;Alsace;frontière;dynamique spatiale;boundary;cross border commuter"	"Alsace,dynamique spatiale,frontière,travail frontalier"	";Cécile , Buxeda"	"2003-09-03"	"fr"	"true"	"0"	"26"
"4870"	"T0078"	"17175694075579110791"	"Vendeurs ambulants à Rio de Janeiro : expériences citadines et défis des pratiques urbaines"	"Street Vendors in Rio de Janeiro: civic experience and urban social practices"	";conflit;social network;ambulantism;vendeur ambulant;métropolisation;réseau de relations;street vendor;ambulantage;conflict;metropolization;camelo"	"ambulantage,métropolisation,vendeur ambulant,camelot,réseau de relations,conflit"	";Caterine , Réginensi;Maria , De Fatima Cabral Gomes"	"2007-03-19"	"fr"	"true"	"0"	"40"
"5367"	"T0710"	""	"Universités : courage fuyons !"	""	";web;lm"	"lmd,web"	""	"2003-11-15"	"fr"	"false"	"0"	"0"
"25310"	"T1009"	""	"L’influence des parties prenantes dans les grands projets urbains"	"The influence of stakeholders in large urban projects. The cases of the Quartier des spectacles de Montréal and Lyon Confluence"	";project management;North America;large urban project;grand projet urbain;Amérique du Nord;participation publique;gouvernance;Urban planning;Citizen participation;France;process;acteurs;parties prenantes;Canada;Urbanisme;gestion de projet;processus;stakeholders;governanc"	"acteurs,Amérique du Nord,Canada,France,gestion de projet,gouvernance,grand projet urbain,participation publique,parties prenantes,processus,Urbanisme"	";Isabelle , Thomas-Maret;Laurent , Viel;Fella Amina , Maherzi;Gonzalo , Lizarralde"	"2012-04-26"	"fr"	"true"	"0"	"39"
"2154"	""	"3779852770085058080"	"Scale and the Wartime <em>Saturday Evening Post</em>: A Geographical Strategy of Nation Building"	""	";scale;échelle géographique;Saturday Evening Post;identité nationale;national identit"	"échelle géographique,identité nationale,Saturday Evening Post"	";Louise , Appleton"	"2002-06-24"	"en"	"false"	"0"	"48"
"25076"	"T1069"	""	"Débat entre Denise Pumain et Henri Reymond à propos de l'article « T-Sphère » et médiance espace/étendue. L’antagoniste contradictoire et le concept de géoanthroposystème"	""	""	""	";Denise , Pumain;Henry , Reymond"	"2011-02-10"	"fr"	"false"	"0"	"0"
"18862"	"T0742"	""	"Présence de la publicité automobile dans la presse écrite belge : Analyse des quotidiens La Libre Belgique et Le Soir et des hebdomadaires Trends-Tendances et Le Vif-L’Express"	"Presence of car advertising in the Belgian written press: Analysis of the dailies La Libre Belgique and Le Soir and the weeklies Trends-Tendances and Le Vif-L’Express"	";publicité;réchauffement climatique;cars;automobile;presse écrite;advertising;CO2;written press;global warmin"	"automobile,CO2,presse écrite,publicité,réchauffement climatique"	";Pierre , Ozer"	"2008-06-02"	"fr"	"true"	"0"	"9"
"1018"	"T0218"	"312768424524227714"	"Ethnoburb versus Chinatown : Two Types of Urban Ethnic Communities in Los Angeles"	""	";cultural geography;géographie culturell"	"géographie culturelle"	";Li , Wei"	"1998-12-10"	"en"	"false"	"0"	"10"
"333"	"T0352"	"15677838157539969624"	"The Region : A basic Concept for understanding local Areas and Global Systems"	""	";region;cultural area;regional development;functional region;historical regio"	""	";Antoine S. , Bailly"	"1998-02-02"	"en"	"false"	"0"	"3"
"10461"	"T0322"	""	"Fondements et approche d’un modèle cognitif du déplacement"	"Underpinning and approach for a cognitive modeling of wayfinding Computing real and perceived displacement difficulties for disabled people in public buildings"	";wayfinding;orientation;mental map;perception spatiale;carte mentale;système d’information géographique;affordances;geographical information system;spatial perceptio"	"système d’information géographique,perception spatiale,orientation,carte mentale,affordances,wayfinding"	";Pierre-Emmanuel , Michon;David , Duguay;Geoffrey , Edwards"	"2007-10-01"	"fr"	"true"	"0"	"5"
"3144"	""	"13243337309915853256"	"Traduire Christaller en français. <br />Textes seuils, réception, récit de découverte"	"Translate Christaller in French"	";Christaller;traduction;théorie des lieux centraux;translation;theory of central place"	"Christaller,théorie des lieux centraux,traduction"	";M. , Covindassamy;G. , Djament"	"2005-01-25"	"fr"	"true"	"0"	"35"
"4955"	"T0075"	"7806833989646099925"	"Les compagnies aériennes low cost sont-elles toujours un levier du développement local ?"	""	";économie géographiqu"	"économie géographique"	";Jean , Bouinot"	"2007-03-09"	"fr"	"false"	"0"	"0"
"996"	"T0355"	"11792576881837976183"	"A geographical method to assess technological hazards.The example of the storage and the distribution of the fuel oils in the urban region of Ile-de-France"	""	";évaluation des risques;transport de matières dangereuses;technological hazards;risque majeur;transport of hazardous substances;risk assessment;GIS;SI"	"évaluation des risques,risque majeur,transport de matières dangereuses,SIG"	";Sandrine , Glatron"	"2001-07-04"	"en"	"false"	"0"	"12"
"26080"	"T1123"	"16276926260691188890"	"Recompositions territoriales en Provence-Alpes-Côte d’Azur : Analyse croisée par les mobilités quotidiennes et résidentielles"	"Territorial Reorganisation in the Provence-Alpes-Côte d’Azur Region: Cross-Analysis through Daily and Residential Mobility"	";Dominant Flows;métropolisation;Commuting;Provence-Alpes-Côte d’Azur Region;Provence-Alpes-Côte d’Azur;flux dominants;navettes domicile-travail;migrations résidentielles;Urban Network;Residential Mobility;réseaux urbains;Metropolisatio"	"métropolisation,réseaux urbains,navettes domicile-travail,migrations résidentielles,flux dominants,Provence-Alpes-Côte d’Azur"	";Giovanni , Fusco;Floriane , Scarella"	"2013-11-29"	"fr"	"true"	"0"	"30"
"3790"	"T0099"	"10419638455288387263"	"Time and space scales for measuring urban growth "	""	";France;concentration;urban growth;système de villes;urban sprawl;étalement urbain;hiérarchisation;space-tim"	"étalement urbain,hiérarchisation,système de villes,France"	";Denise , Pumain;Fabien , Paulus;Anne , Bretagnolle"	"2002-07-25"	"en"	"false"	"0"	"20"
"23733"	""	"17495142995204539687"	"Entre patrimoine, tourisme et agriculture : difficulté d’un choix de gestion dans un espace multifonctionnel. Application aux <em>chinampas</em> de Xochimilco (Mexique)"	"Between heritage, tourism and agriculture: difficulty of a choice of management in a multifunctional space. Application to chinampas Xochimilco (Mexico)."	";management; multifunctionality; heritage; tourism; agriculture; Mexico City;gestion ; multifonctionnalité ; patrimoine ; tourisme ; agriculture ; Mexic"	"gestion ; multifonctionnalité ; patrimoine ; tourisme ; agriculture ; Mexico"	";Céline , Clauzel"	"2011-05-27"	"fr"	"true"	"0"	"20"
"26483"	"T1163"	""	"Simuler les évolutions de l’utilisation du sol pour anticiper le futur d’un territoire"	"Simulating land use change to anticipate the becoming of a territory. Critical analysis of a geoprospective experience in a peri-urban catchment (Yzeron, Lyon metropolitan area)"	";territory;spatial strategic foresight;spatial land cover modeling;atelier participatif;territoire;participatory workshop;géoprospective;utilisation du sol;simulation;scenario building;scénario;land us"	"géoprospective,territoire,atelier participatif,scénario,simulation,utilisation du sol"	";Anne , Rivière-Honegger;Thierry , Joliveau;Clément , Dodane"	"2014-10-01"	"fr"	"true"	"0"	"46"
"305"	"T0655"	""	"Managing megacities"	""	""	""	";Rémy , Prud'homme"	"1996-04-12"	"en"	"false"	"0"	"1"
"1514"	"T0323"	"14695141168506686219"	"Participation et construction de barrage à Alqueva (Portugal). Quelles méthodes, quels moyens ?"	"Participation and Dam Construction in Alqueva (Portugal). What Methods, what Means?"	";Portugal;dam;barrag"	"barrage,Portugal"	";Fabienne , Wateau"	"2004-12-16"	"fr"	"true"	"0"	"3"
"6288"	"T0052"	"9369789144628550123"	"Sous la page, la qualité ! et les nouveautés…"	""	""	""	";Denise , Pumain;Christine , Kosmopoulos"	"2007-05-31"	"fr"	"false"	"0"	"0"
"497"	"T0201"	"17776733059003091715"	"L'apport de la sémiologie graphique de Jacques Bertin a la cartographie pour l’aménagement et l'urbanisme"	"Cartography in urban and regional planning : what brought the Jacques Bertin's graphic semiology to the discipline ?"	";sémiologie graphiqu"	"sémiologie graphique"	";Jean , Steinberg"	"2000-11-17"	"fr"	"true"	"0"	"0"
"23369"	"T0895"	"6434177407385527896"	"Politiques de la fragmentation urbaine et violence, l’exemple de Kingston, Jamaïque"	"Urban fragmentation politics and violence, the case of Kingston, Jamaica."	";segregation;fragmentation;géopolitique;comparaisons;Jamaïque;Willy Linch syndrom;syndrome de Lynch;Jamaica;geopolitics;comparison;culture;Kingsto"	"Kingston,Jamaïque,fragmentation,géopolitique,culture,comparaisons,syndrome de Lynch"	";Romain , Cruse"	"2010-11-25"	"fr"	"true"	"0"	"47"
"2436"	"T0170"	"71701339042918686"	"Calibrer un modèle d’évolution de l’occupation du sol urbain. L’exemple de Belfort"	"Calibrating a model of urban land change. An example in Belfort"	";modélisation;prospective;urban planning;concertation participative;prospect;participative design;urbanisme;modelling;simulatio"	"concertation participative,modélisation,prospective,simulation,urbanisme"	";Jean-Philippe , Antoni"	"2006-07-19"	"fr"	"true"	"0"	"22"
"959"	""	"9777460997876776955"	"Levy P., 2000, <em>World Philosophie</em>, Paris, Editions Odile Jacob, 220 p."	""	""	""	";Christine , Kosmopoulos"	"2001-02-07"	"fr"	"false"	"0"	"0"
"25569"	"T1074"	"9539524002745732470"	"A geopolitics of peace"	""	""	""	";Denise , Pumain"	"2012-10-12"	"en"	"false"	"0"	"0"
"3013"	"T0065"	"17943971464730409664"	"Les conceptions initiales des élèves turcs de CM2 relatives aux séismes"	"The initial concept of fifth graduate turkishs students related to earhtquakes"	";geology;physical geography;representation initial;concept;géologie;géographie physique;obstacle;earthquake;tremblement de terre;représentation initial"	"concept,représentation initiale,obstacle,géographie physique,géologie,tremblement de terre"	";Burckin , Dal"	"2005-11-21"	"fr"	"true"	"0"	"23"
"4856"	"T0239"	"12713085985839421615"	"Socio-spatial lifestyles and segregation "	""	";ségrégation globale;relative weights;valeurs initiales;spatial segregation;initial values;overall segregation;poids relatif;espace-temps quotidien;everyday life space;lifestyle;social segregation;mode de vie;ségrégation spatiale;ségrégation social"	"ségrégation sociale,ségrégation spatiale,ségrégation globale,espace-temps quotidien,mode de vie,valeurs initiales,poids relatif"	";Schnell , Izhak;Benjamini , Yoav"	"1999-04-27"	"en"	"false"	"0"	"33"
"1572"	""	""	"Some methods for the determination and the evaluation of non-fragmented and minimal disturbed landscape areas <a class=footnotecall id=bodyftn1 href=#ftn1>1</a>"	""	""	""	";Olaf , Kappler"	"1998-12-10"	"en"	"false"	"0"	"15"
"3352"	""	""	"Les représentations sociales du paysage comme outils de connaissance préalable à l'action. L'exemple des Alpes du nord"	"Social representations as a prerequisite knowledge to support local action. The example of the French Northern Alps"	";modèle paysager;social representation;paysage;négociation;local development;développement local;landscape;représentation sociale;negociation;social modelling of landscap"	"représentation sociale,paysage,modèle paysager,développement local,négociation"	";Emmanuel , Guisepelli"	"2005-05-03"	"fr"	"true"	"0"	"22"
"589"	"T0395"	""	"La publication scientifique en ligne et le libre accès. Pourquoi tant de retard ?"	""	""	""	";Christine , Kosmopoulos"	"2005-05-12"	"fr"	"false"	"0"	"0"
"25588"	"T1068"	"16410103917969209669"	"Transformation des mosaïques de forêt-savane par des pratiques agroforestières en Afrique subsaharienne (Guinée et Cameroun)"	"Transformation of the mosaics of forest-savannas by agroforestry practices in sub-Saharan Africa (Guinea, Cameroon)"	";mosaïque forêt-savane;coffee;Systèmes agroforestiers;dynamique spatio-temporelle;caféier;cacaoyer;spatio-temporal dynamics;Guinée;food crops;Cameroun;Guinea;cocoa;mosaic forest-savannah;Cameroon;Agro-forestry system;innovation;cultures vivrière"	"Systèmes agroforestiers,dynamique spatio-temporelle,mosaïque forêt-savane,caféier,cacaoyer,cultures vivrières,innovation,Guinée,Cameroun"	";Hubert de , Foresta;Patrick , Dugué;Aboubacar Ahmadou , Camara"	"2012-12-06"	"fr"	"true"	"0"	"32"
"23015"	"T0881"	"9974276458981970637"	"La Chine : interrogations sur un avenir"	""	""	""	";Pierre , Gentelle"	"2010-04-14"	"fr"	"false"	"0"	"8"
"24168"	"T0960"	"1278739482361996123"	"Femmes orientales et photographes commerciaux. La construction d’un imaginaire dans la production photographique des années 1860-1880"	"Oriental Women and Commercial Photographers. The Construction of an Imaginary in the Photographic Production of the 1860’s through the 1880’s"	";genre;imaginaire;eroticism;Orient;femme;gender;imaginary;érotisme;women;photographie;photograph"	"érotisme,femme,genre,imaginaire,Orient,photographie"	";Lionel , Gauthier"	"2011-10-13"	"fr"	"true"	"0"	"51"
"927"	""	"11690757557790093336"	"Miles M., Borden I. Hall T., 2000, <em>The City Cultures Reader</em>, London, Routlege."	""	""	""	";Didier , Mendibil"	"2001-05-15"	"fr"	"false"	"0"	"0"
"3742"	"T0214"	"7972984737099800219"	"Utilisation de typologies multi-dates pour l’analyse des transformations socio-spatiales de Bogota (Colombie)"	"Use of multidates typologies for the analysis of sociospace transformation of Bogota (Colombia)"	";multidates typological analysis;analyse typologique multidates;sociospace dynamic;dynamique socio-spatiale;Bogot"	"analyse typologique multidates,Bogota,dynamique socio-spatiale"	";Marie , Piron;Françoise , Dureau;Christian , Mullon"	"2004-02-05"	"fr"	"true"	"0"	"26"
"26530"	"T1161"	"11254389379718810919"	"SLIDER: Software for LongItudinal Data Exploration with R"	""	";shiny web application;longitudinal data;visualisation interactive;application shiny;R software;logiciel R;données longitudinales;interactive visualizatio"	"visualisation interactive,données longitudinales,logiciel R,application shiny"	";Hadrien , Commenges;Robin , Cura;Pierre , Pistre"	"2014-11-07"	"en"	"false"	"0"	"13"
"2519"	"T0174"	"4032759008048105645"	"An evolutionary theory for interpreting urban scaling laws"	""	";cycles d’innovation;scaling laws;théorie évolutive;lois d’échelle;système urbain;evolutionary theory;activité urbaine;urban system;urban function;innovation cycle"	"activité urbaine,cycles d’innovation,lois d’échelle,système urbain,théorie évolutive"	";Denise , Pumain;Fabien , Paulus;José , Lobo;Céline , Vacchiani-Marcuzzo"	"2006-07-05"	"en"	"false"	"0"	"38"
"219"	""	""	"L'île mystérieuse - JULES VERNE - 1874 <br />HYDROGRAPHIE ET OROGRAPHIE. L'ÎLE EST-ELLE HABITÉE ?<br />BAPTÊME DES BAIES, CAPS, GOLFES, RIVIÈRES..."	""	";Géographi"	""	";Jean-Louis , TISSIER"	"1996-04-25"	"fr"	"false"	"0"	"0"
"3046"	"T0072"	"15407204464231071686"	"Une sélection de 90 sites web sur les diasporas"	"90 Selected Diasporas Web Sites"	";Kurdish;web addresses;Jewish;African;kurde;Indian;Concept of Diaspora;africaine;Caucasian Diasporas.;Chinese;concept de diaspora;Armenian;caucasienne;adresses Web;juive;Greek;grecque;asiatique;diaspora arménienn"	"adresses Web,concept de diaspora,diaspora arménienne,grecque,juive,africaine,asiatique,kurde,caucasienne"	";Françoise , Rollan"	"2005-11-07"	"fr"	"true"	"0"	"8"
"1260"	"T0408"	"336883715354745052"	"Aspects institutionnels de la gestion durable de l’eau en Europe"	"Institutional dimension of sustainable water management in Europe"	";gestion multiniveaux;Directive Cadre;intergovernmentality;subsidiarity;ressource d'eau;Framework Directive;patrimoine commun;common property;subsidiarité;water resource"	"Directive Cadre,gestion multiniveaux,patrimoine commun,ressource d'eau,subsidiarité"	";Bernard , Barraqué"	"2004-11-15"	"fr"	"true"	"0"	"1"
"5069"	"T0714"	""	"Concepts pour la description de bases de données multi-représentation"	"Concepts used for multiple-resolution representations"	";multi-représentation;spatial resolution;spatial data model;données spatiales;résolution sémantique;semantic resolution;multiple representation;résolution spatiale;modèl"	"données spatiales,modèle,multi-représentation,résolution sémantique,résolution spatiale"	";Christelle , Vangenot"	"1999-06-16"	"fr"	"true"	"0"	"0"
"5145"	"T0460"	"16729666788269459343"	"Analyse spatiale des phénomènes géographiques"	"Spatial analysis and geographical phenomena"	";spatial analysis;cartography;cartographie;chorématique;phénoménologie;chorematic;analyse spatiale;phenomenolog"	"analyse spatiale,cartographie,chorématique,phénoménologie"	";Jean-François , Hangouet"	"1999-06-16"	"fr"	"true"	"0"	"0"
"26946"	""	""	"Ter Minassian H., 2013, <em>Changer Barcelone.</em><em> Politiques publiques et gentrification dans le centre ancien (Ciutat Vella)</em>, Toulouse, Presses universitaires du Mirail, 315 p."	""	""	""	";Thérèse , Saint-Julien"	"2015-04-10"	"fr"	"false"	"0"	"1"
"24607"	"T0981"	"10834070490085610001"	"The tsunami in South-East Asia – a retrospective analysis of the management of an apocalyptic natural disaster"	""	";risk management;warning system;land use planning;south-east Asia;hazard;vulnerability;natural risk;education;tsunam"	""	";Pierre , Ozer;Angéla , Verdier;Florence de , Longueville"	"2011-10-28"	"en"	"false"	"0"	"49"
"623"	"T0413"	"2799793891279597268"	"Analyse de la mobilité des paysages et des systèmes sociaux en Thessalie : l’apport des images Landsat TM"	""	";télédétection;remote sensin"	"télédétection"	";Éric , Fouache;Bernard , Helly;Pierre-Gil , Salvador;Bezunesh , Tamru"	"2000-05-05"	"fr"	"false"	"0"	"3"
"12053"	""	"10371544298177760033"	"Touchart L. (dir.), 2007, <em>Géographie de l’étang. Des théories globales aux pratiques locales</em>, Paris, L’Harmattan, 228 p."	""	""	""	";Gérard , Hugonie"	"2007-10-30"	"fr"	"false"	"0"	"0"
"26336"	"T1143"	"2757512955823220391"	"Réseaux de villes et processus de recomposition des niveaux : le cas des villes baltiques"	""	";international relations;Sea Region;villes;cities;réseaux de villes;rescaling;city-networks;Europe;recomposition des niveaux;Baltique;the Baltic;coopérations internationales;régionalisation;regionalis"	"réseaux de villes,villes,coopérations internationales,régionalisation,Europe,Baltique,recomposition des niveaux"	";Lise , Vaudor;Nicolas , Escach"	"2014-07-05"	"fr"	"false"	"0"	"34"
"789"	""	"5854253757779545414"	"Collignon B. et Staszak J.-F. (dir.),2003, <em>Espaces domestiques. Construire, habiter, représenter</em>, Paris, Bréal."	""	""	""	";Marianne , Blidon"	"2004-10-05"	"fr"	"false"	"0"	"0"
"5516"	"T0087"	""	"Nos partenaires scientifiques"	""	""	""	""	"2007-05-21"	"fr"	"false"	"0"	"0"
"3634"	"T0158"	"11264242014207863537"	"Contribution to fractal Analysis of cities : A Study of metropolitan Area of Milan "	""	";fractales;urbanized surface;surface urbanisée;Milan;perimeter;périmètre;fractal"	"fractales,Milan,périmètre,surface urbanisée"	";Rabino , Giovanni;Matteo , Caglioni"	"2004-04-20"	"en"	"false"	"0"	"9"
"5308"	""	""	"Les <em>mots justes</em><a class=footnotecall id=bodyftn1 href=#ftn1>1</a> <a id=retour1></a><a id=bkmretour1></a>de Jean Gottmann"	""	""	""	";Luca , Muscara"	"1998-03-26"	"fr"	"false"	"0"	"53"
"672"	"T0389"	""	"Mise en évidence d'indicateurs de la dynamique biogéographique en moyenne montagne pyrénéenne par analyses multicsalaire et multitemporelle de photographies aériennes et d'images satellitaires"	"Finding biogeographic dynamic pointer in Pyrénées middle mountain through multiscalar and multiperiod remote sensing use"	";télédétection;remote sensin"	"télédétection"	";Gilles , Selleron;Franck , Vidal"	"2000-05-05"	"fr"	"true"	"0"	"0"
"4959"	"T0286"	"6856055526738789570"	"Les facteurs de choix des localisations : les infrastructures de transport"	""	";économie géographiqu"	"économie géographique"	";Jean , Bouinot"	"2007-03-09"	"fr"	"false"	"0"	"6"
"768"	""	"23480307018031679"	"Bethemont J., <em>La Méditerranée en partage, documentation photographique, dossier n° 8039</em>, Paris, La Documentation Française, 2004."	""	""	""	";Gilles , Palsky"	"2005-03-17"	"fr"	"false"	"0"	"0"
"6281"	"T0396"	""	"‘On the Front Page’ – and Behind the Front Page, Quality! And New Releases"	""	""	""	";Denise , Pumain;Christine , Kosmopoulos"	"2007-06-04"	"en"	"false"	"0"	"0"
"25932"	"T1085"	"16883378651468319002"	"Les bienfaits de la mondialisation"	""	""	""	";Denise , Pumain"	"2013-05-14"	"fr"	"false"	"0"	"0"
"22881"	"T0877"	"18348554669406576855"	"Contribution béninoise à la géographie"	"Beninese’s Contribution to Geography"	";thèses;géographie béninoise;geographic thought;développement;development;laboratoires;Beninese geography;enseignement;inductive or deductive approach;epistemology;thesi"	"développement,enseignement,géographie béninoise,laboratoires,thèses"	";Noukpo , Agossou"	"2010-01-19"	"fr"	"true"	"0"	"67"
"6736"	"T0132"	"10391060056115799216"	"Qualité de l’offre et usage du transport public en milieu urbain"	"Quality of the supply and use of the public transportation in urban areas"	";bus transportation supply;modal efficiency;modal choice;choix modal;offre de transport en commun;mobilité urbaine;urban mobility;efficacité modal"	"choix modal,efficacité modale,mobilité urbaine,offre de transport en commun"	";Cyrille , Genre-Grandpierre"	"2007-06-05"	"fr"	"true"	"0"	"20"
"277"	"T0565"	""	"Urban biodiversity: is there such a thing?"	""	""	""	";Philippe , Clergeau"	"1996-04-12"	"en"	"false"	"0"	"1"
"3812"	"T0337"	"2309329111949234381"	"Cartographie d’aujourd’hui et de demain : rappels et perspectives."	"Today's and tomorrow's mapping : recalls and prospects"	";visualization;dimension;cartographie;mapping;visualisatio"	"cartographie,dimension,visualisation"	";Isabelle , Thomas"	"2001-03-27"	"fr"	"true"	"0"	"0"
"5383"	"T0659"	"15213712610930785374"	"A propos de la canicule… Aléa et vulnérabilité"	""	""	""	";Paul , Caseau"	"2003-09-12"	"fr"	"false"	"0"	"0"
