"id"	"UID"	"SCHID"	"Title"	"Title_en"	"keywords_en"	"keywords_fr"	"authors"	"date"	"langue"	"translated"	"numciting"	"numcited"
"2654"	"T0299"	"3129832376861581383"	"Spatially aggregated data and variables in empirical analysis and model building for economics"	""	";spatial analysis;spatial autocorrelation;modèle numérique de terrain;analyse spatiale;autocorrélation spatiale;erreur écologique;ecological fallacy;quantitative modellin"	"analyse spatiale,autocorrélation spatiale,erreur écologique,modèle numérique de terrain"	";Tamás , Dusek"	"2004-09-09"	"en"	"false"	"0"	"33"
"2536"	"T0008"	"5414079965684248116"	"Revue de la typologie des éruptions au Piton de La Fournaise, processus et risques volcaniques associés"	"Review of volcanic eruption typology at the Piton de la Fournaise, processes and hazards"	";risque volcanique;Réunion Island;Piton de la Fournaise;typologie des éruptions;magmatisme;magmatism;eruption typology;volcanic hazard;île de la Réunio"	"île de la Réunion,magmatisme,Piton de la Fournaise,risque volcanique,typologie des éruptions"	";Patrick , Bachèlery;Nicolas , Villeneuve"	"2006-03-30"	"fr"	"true"	"0"	"21"
"4895"	""	""	"Business networ"	""	";servicios;franchise;trade;Spain;franquicias;business networks;service;redes empresariales;España;comercio minorist"	""	";Ricardo , Méndez;Agustín , Gámir"	"1999-05-17"	"en"	"false"	"0"	"41"
"26021"	"T1104"	"1013769405606521444"	"Piantoni F., 2011, Migrants en Guyane, Arles, Actes Sud / Musée des cultures guyanaises, 176 p."	""	""	""	";Violaine , Jolivet"	"2013-08-07"	"fr"	"false"	"0"	"8"
"23175"	"T0886"	"7516204158801455444"	"Modélisation des objets historiques selon la fonction, l’espace et le temps pour l’étude des dynamiques urbaines dans la longue durée"	"Modeling historical objects based on social use, space and time in order to study urban dynamics in large time span"	";espace;historical sciences;fonctions urbaines;sciences historiques;Système d’information géographique;ville;modelling;temps;space;urban function;geographical information system;space-time;temporalité;city;modélisation;time;dynamiques spatiales;espace-temps;spatial dynamic"	"dynamiques spatiales,espace,espace-temps,fonctions urbaines,modélisation,sciences historiques,Système d’information géographique,temporalité,temps,ville"	";Laure , Saligny;Xavier , Rodier"	"2010-06-17"	"fr"	"true"	"0"	"45"
"853"	""	"12827769133103007003"	"Bouinot J., 2002, <em>La Ville Compétitive ; Les clés de la nouvelle gestion urbaine</em>. Paris, Economica, collection Gestion, 180 pages."	""	""	""	";Denise , Pumain"	"2002-08-28"	"fr"	"false"	"0"	"0"
"25187"	"T1024"	"12973683941146739970"	"Mesurer la notoriété touristique communale : contribution méthodologique à l’aide de l’analyse textuelle de guides touristiques"	"Using textual analysis of travel guidebooks to measure touristic attractiveness at the local level: a methodological approach"	";notoriété touristique communale;guides touristiques;indicateur statistique;textual analysis;localized attractiveness;test méthodologique;travel guidebooks;tourism;analyse textuelle;statistical indicator;tourisme;methodolog"	"tourisme,notoriété touristique communale,test méthodologique,analyse textuelle,indicateur statistique,guides touristiques"	";Guillaume , Ollivier;Ghislain , Geniaux;Claude , Napoléone;Jean-Christophe , Paoli"	"2012-03-01"	"fr"	"true"	"0"	"75"
"5332"	"T0031"	"8908082973676945930"	"La réception du modèle graphique de Burgess dans la géographie française des années cinquante aux années soixante-dix"	""	";France;assimilation;graphic model;réception;modèle graphique;Chicago;Burges"	"modèle graphique,réception,Burgess,France,Chicago"	";Jacquemine , Garel;Pascal , Clerc"	"1998-05-22"	"fr"	"false"	"0"	"0"
"5539"	"T0733"	""	"La preuve apportée par les sciences"	""	""	""	""	"1997-04-04"	"fr"	"false"	"0"	"0"
"6547"	"T0372"	"10951105850887304985"	"Télédétection, numérisation et transferts d’échelle dans l’étude géographique des milieux physiques et urbains"	"Remote sensing, digitalisation and scale change in the study of natural and urban environment"	";télédétection;remote sensin"	"télédétection"	";Jean-Louis , Drouot;Yann , Callot"	"2000-04-25"	"fr"	"true"	"0"	"3"
"25488"	"T1052"	"10845239633598044892"	"The various figures of Mountains in Humboldt’s Science and Rhetoric1"	""	""	""	";Bernard , Debarbieux"	"2012-08-21"	""	"false"	"0"	"35"
"3280"	"T0112"	"2941939649222970387"	"Analyse d’un front pionnier par images satellitales multidates de 1987 à 2002. Le cas du nord-ouest du Petén (Guatemala)"	"Analyse of a pioneer front by multidate satellite images 1987 - 2002. The case of the North-West of Petén (Guatemala)"	";Petén;temporal environmental change;archaeology;dynamique végétale;cartography;cartographie;Mayas;Guatemala;archéologie;construction territoriale;structure spatiale;spatial structure;vegetation dynamics;front pionnier;Maya;spatial dynamic;image processing;changement environnemental;analyse et traitement d'image;territorial construction;pionnier front;télédétection;dynamique spatiale;remote sensin"	"front pionnier,dynamique spatiale,dynamique végétale,construction territoriale,structure spatiale,changement environnemental,archéologie,Mayas,analyse et traitement d'image,télédétection,cartographie,Petén,Guatemala"	";Gilles , Selleron"	"2004-10-28"	"fr"	"true"	"0"	"32"
"26795"	""	"5013879988439767971"	"Voyage (à vélo) au pays de Poutine"	"Travel (by bike) to the country of Putin"	";Bolshaya Izhora;Kingisepp;Gulf of Finland;Выборг;Петр Великий;Ivangorod;Catherine II;Большая Ижора;Peter the Great;Russian Museum;Русский музей;St.Petersburg;Musée russe;Невский проспект;Saint Pétersbourg;Екатерина II;Bolchaya Ijora;Catherine the Great;Pierre-le-Grand;Финский залив;Vyborg;Nevsky prospekt;Санкт-Петербург;Nevsky Prospekt;Ивангород;Кингиспп;Golfe de Finland"	"Saint Pétersbourg,Vyborg,Nevsky prospekt,Musée russe,Bolchaya Ijora,Kingisepp,Ivangorod,Golfe de Finlande,Pierre-le-Grand,Catherine II"	";Bruno , Koper"	"2015-03-03"	"fr"	"true"	"0"	"0"
"4087"	"T0626"	"16548590329634001583"	"L’évolution des lithométéores en Mauritanie confirme une plus grande efficacité de l’action éolienne"	"The evolution of lithometeores in Mauritania confirms a bigger efficiency of the action eolienne"	";lithometeore;sécheresse;dégradation environnementale;lithométéore;risque éolien;eolian risk;environmental degradation;drough"	"dégradation environnementale,lithométéore,risque éolien,sécheresse"	";Zeineddine , Nouaceur"	"2001-12-18"	"fr"	"true"	"0"	"0"
"25892"	"T1084"	"18026423820145262245"	"Croissance urbaine et accessibilité : intérêts et limites de l’approche par les densités dans une perspective de modélisation de l’usage du sol"	"Urban growth and accessibility: interest and limits of density approach for a LUTI model perspective"	";modèle de Bussière;urban growth;accessibilité;Bussière model;density;modèle transport-urbanisme;LUTI model;densité;croissance urbaine;accessibilit"	"modèle de Bussière,accessibilité,densité,croissance urbaine,modèle transport-urbanisme"	";Guillaume , Monchambert;Patrick , Bonnel;Louafi , Bouzouina"	"2013-04-15"	"fr"	"true"	"0"	"43"
"1005"	"T0669"	"8956198491549021629"	"12th European Colloquium on Quantitative and Theoretical Geography. St-Valery-en-Caux, September 7-11, 2001 "	""	""	""	";Yves , Guermond"	"2001-09-11"	"en"	"false"	"0"	"0"
"5351"	"T0223"	""	"Des appareils photo jetables au service d´un projet de développement : représentations paysagères et stratégies des acteurs locaux de la montagne thiernoise"	""	";Massif central;représentation paysagère;développement loca"	"développement local,Massif central,représentation paysagère"	";Yves , Michelin"	"1998-12-07"	"fr"	"false"	"0"	"15"
"801"	""	""	"Pumain D., Mattei M.-F. (dir), 2003, <em>Données urbaines </em>4, Collection Villes, Anthropos-Economica, avec le concours de l’INSEE, de l’ACI Ville du ministère de la recherche et le soutien du CNRS, 429 p."	""	""	""	";Céline , Rozenblat"	"2003-12-08"	"fr"	"false"	"0"	"0"
"26032"	"T1093"	""	"Infrastructure de données géographiques et gestion intégrée de la zone côtière"	"Spatial Data Infrastructure and Integrated Coastal Zone Management: lessons from the experience of MIMEL"	";coastal zone;Spatial Data Infrastructure;Geomatic;littoral;GIZC;information géographique;infrastructure de données géographiques;ICZM;GIS;SIG;geographic information;Géomatiqu"	"Géomatique,information géographique,infrastructure de données géographiques,SIG,GIZC,littoral"	";Laurence , David;Loïc , Nogues;Iwan , Le Berre;Julien , Defenouillère;Matthieu , Le Tixerant"	"2013-09-11"	"fr"	"true"	"0"	"46"
"1796"	"T0167"	"4515323814311613942"	"Biographie et bibliographie de Pierre Deffontaines (1894-1978) "	"Pierre Deffontaines' biography and bibliography"	";Pierre Deffontaines;histoire de la géographie;biographie;history of geography;biograph"	"Pierre Deffontaines,biographie,histoire de la géographie"	";Claire , Delfosse"	"2000-03-09"	"fr"	"true"	"0"	"7"
"23637"	""	""	"Les oubliées du “désir du rivage” ? L’image des zones humides littorales dans la peinture et la société françaises depuis le XVIII<sup>e</sup> siècle"	"Coastal wetlands aside from “the lure of the sea”? Their image in French painting and society since the XVIIIth century"	";coastal zone;peinture française;French painting;littoral;geography;wetlands;zones humides;perception;représentations sociales;géographi"	"géographie,peinture française,littoral,zones humides,représentations sociales"	";Lydie , Goeldner-Gianella;Corinne , Feiss-Jehel;Geneviève , Decroix"	"2011-05-20"	"fr"	"true"	"0"	"38"
"3989"	"T0193"	"431657500073651820"	"Les enjeux politiques de l’hindouisme dans l’Inde actuelle"	"The political challenges of Hinduism in contemporary India"	";discrimination positive;Hinduism;hindouité;démocratie parlementaire;hindouisme;decentralisation;gouvernance;partis régionaux;nationalisme hindou;hindutva;décentralisation;positive discrimination;regional party;Hindu nationalism;parliamentary democracy;governanc"	"décentralisation,démocratie parlementaire,discrimination positive,gouvernance,hindouisme,hindouité,nationalisme hindou,partis régionaux"	";Kamala , Marius-Gnanou"	"2001-02-20"	"fr"	"true"	"0"	"0"
"22818"	""	"1506238703486118209"	"Analyse spatiale de la prolifération de <em>C. gigas</em> en Bretagne"	"Spatial analysis of C. Gigas proliferation in Brittany (France)"	";biogéographie;Bretagne;global change;biogeography;SIG;changement climatique;Brittany;coastal zone;huître;littoral;oyster;Crassostrea gigas;invasive species;GIS;espèce invasiv"	"biogéographie,Bretagne,changement climatique,Crassostrea gigas,espèce invasive,huître,littoral,SIG"	";Raphaël , Gouill;Christian , Hily;Iwan , Le Berre;Morgane , Lejart"	"2009-12-08"	"fr"	"true"	"0"	"33"
"868"	""	"12709744296133693587"	"Vila J., 2000, <em>Dictionnaire de la tectonique des plaques et de la géodynamique</em>, Paris, Gordon &amp; Breach publisher, coll. géosciences, 542 p."	""	""	""	";Yves , Michelin"	"2002-05-23"	"fr"	"false"	"0"	"0"
"24765"	"T0954"	"16689892673366615122"	"Processus de métropolisation dans l’espace frontalier post-soviétique : l’exemple de Rostov-sur-le-Don"	"Process of metropolization in post-soviet border space: the example of Rostov-on-Don"	";système de villes;métropolisation;Rostov-on-Don;Rostov-sur-le-Don;Russia;metropolization;border;system of cities;frontière;Russi"	"frontière,métropolisation,Russie,Rostov-sur-le-Don,système de villes"	";Clémentine , Cottineau"	"2011-11-14"	"fr"	"true"	"0"	"36"
"5043"	"T0179"	"13641350094684458307"	"Pour une approche de la cognition spatiale intra-urbaine"	""	";techniques d'enquête;carte;carte mentale;mental map;cognition spatiale;survey technics;urban space;cognitive configuration;configuration cognitive;map;espace urbain;cognition;spatial cognitio"	"carte,carte mentale,cognition,cognition spatiale,configuration cognitive,espace urbain,techniques d'enquête"	";Colette , Cauvin"	"1999-01-27"	"fr"	"false"	"0"	"75"
"3501"	"T0651"	"9194321693009035484"	"Biobibliografia cronológica de Pierre Monbeig : (Período: 1929-1985)"	"Chronological Biobibliography of Pierre Monbeig (1929-1985)"	";Brésil;histoire de la géographie;Brazil;history of geograph"	"Brésil,histoire de la géographie"	";Heliana , Angotti Salgueiro"	"2002-04-08"	"pt"	"true"	"0"	"0"
"25044"	"T1014"	"7920757286531280395"	"Variations des représentations et perceptions d’espaces publics sonores ordinaires selon les formes urbaines"	"Variations of the representations and perceptions of ordinary sonic public spaces depending on urban forms"	";urban density;perception spatiale;carte mentale;mind map;représentations;representations;densité urbaine;forme urbaine;urban form;paysage sonore;soundscape;spatial perceptio"	"forme urbaine,perception spatiale,paysage sonore,représentations,carte mentale,densité urbaine"	";Laëtitia , Arantes;Solène , Marry"	"2012-01-27"	"fr"	"true"	"0"	"37"
"23231"	"T0872"	""	"Les dynamiques spatiales de la gentrification à Paris"	"The spatial dynamics of gentrification in Paris. A synthesis map"	";social filtering up;Paris.;cartography;working-class neighbourhoods;divisions sociales de l’espace;cartographie;frontier;front pionnier;dynamiques spatiales;quartiers populaires;spatial dynamics;Paris;social divisions of space;embourgeoisement;gentrificatio"	"gentrification,embourgeoisement,divisions sociales de l’espace,dynamiques spatiales,front pionnier,cartographie,quartiers populaires,Paris"	";Anne , Clerval"	"2010-07-20"	"fr"	"true"	"0"	"35"
"23737"	"T0922"	"6099100937901000125"	"La réhabilitation thermique des bâtiments anciens à Paris : comment concilier protection du patrimoine et performance énergétique ?"	"The thermal rehabilitation of the old buildings of Paris: how to conciliate protection of urban heritage and energetic performance?"	";développement urbain durable;énergies;patrimoine urbain;energies;sustainable urban development;Paris;thermal rehabilitation;réhabilitation thermique;urban heritag"	"patrimoine urbain,énergies,développement urbain durable,réhabilitation thermique,Paris"	";Hovig , Ter Minassian"	"2011-05-30"	"fr"	"true"	"0"	"34"
"22221"	"T0815"	"1001727153810824827"	"Processus de décision et Espace d’activités/déplacements. Une approche articulant routine cognitive et adaptation événementielle"	"Decision process and Activity space. An approach linking cognitive routine and occurrence adaptation"	";mobility behaviour;événement;décision;cognitive routine;comportement de mobilité;occurrence;routine cognitive;decision;activity space;espace-temps quotidie"	"comportement de mobilité,décision,espace-temps quotidien,événement,routine cognitive"	";Christophe , Enaux"	"2009-04-30"	"fr"	"true"	"0"	"34"
"509"	""	""	"Dynamic visualization in a developing framework for the representation of geographic data<a class=endnotecall id=bodyftn1 href=#ftn1>i</a>"	""	";sémiologie graphique;graphic semiolog"	"sémiologie graphique"	";Connie , Blok"	"2000-11-17"	"en"	"false"	"0"	"2"
"5315"	"T0263"	"5446609147427552602"	"Quelques remarques à propos de la géographie culturelle"	"Some thoughts on cultural geography"	";cultural geography;épistémologie;epistemology;géographie culturell"	"épistémologie,géographie culturelle"	";Béatrice , Collignon"	"1998-04-07"	"fr"	"true"	"0"	"1"
"26977"	""	"2787123752442980387"	"L’AAG pour les nuls"	"The AAG for Dummies"	";United States;AAG;geography;colloque;États-Unis;meeting;géographi"	"AAG,colloque,géographie,États-Unis"	";Marianne , Blidon"	"2015-05-13"	"fr"	"true"	"0"	"0"
"12653"	"T0609"	""	"GIS-based accessibility analysis for network optimal location model"	""	";temps de transport;gradient de pente;Digital Elevation Model (DEM);Modèle Digital d’Elévation de Terrain;moindre cout;plus court chemin;least cost path;model de localisation optimal;SIG;analyse de réseau;bioénergie;bio-energy;gradient slope;network analysis;optimal location model;GIS;accessibility;time of trave"	"SIG,analyse de réseau,temps de transport,Modèle Digital d’Elévation de Terrain,gradient de pente,plus court chemin,moindre cout,model de localisation optimal,bioénergie"	";Sylvie , Dubuc"	"2007-11-26"	"en"	"false"	"0"	"19"
"3359"	"T0178"	"15803454302107023131"	"Elections régionales 2004, deuxième tour : Plongée socio-électorale sous la vague rose"	""	""	""	";Jean-Paul , Gosset;Céline , Colange;Michel , Bussi;Jérome , Fourquet"	"2004-04-01"	"fr"	"false"	"0"	"0"
"4141"	"T0003"	"4110836529507781646"	"The Amur River border. Once a symbol of conflict, could it turn into a water resource stake?"	""	";water;développement;Chine;development;Heilongjiang;water management;Russia;eau;border;Amour;gestion de l’eau;frontière;China;Amur;Russi"	"Amour,Chine,développement,eau,frontière,gestion de l’eau,Heilongjiang,Russie"	";Frédéric , Lasserre"	"2003-07-30"	"en"	"false"	"0"	"3"
"12013"	""	"9225682399054850025"	"Ovenden M., 2004, <em>Metro maps of the world</em>. London. Capital Transport Publishing.136 p."	""	""	""	";Angèle , Charpentier"	"2005-09-27"	"fr"	"false"	"0"	"0"
"799"	""	"6101448256360474106"	"Lepetit B., Topalov C., 2001, <em>La ville des sciences sociales,</em> Belin, 409 p."	""	""	""	";Nathalie , Blanc"	"2003-12-15"	"fr"	"false"	"0"	"0"
"4772"	"T0574"	""	"Carnet de voyage en terre déodatienne"	""	";voyag"	"voyage"	";Eric , Breton"	"2001-10-20"	"fr"	"false"	"0"	"0"
"23243"	""	""	"Orain O., 2009, <em>De plain-pied dans le monde, écriture et réalisme dans la géographie française du XXe siècle</em>. Paris, L’Harmattan, Histoire des sciences humaines, 427 p."	""	""	""	";Claude , Bataillon"	"2010-08-30"	"fr"	"false"	"0"	"0"
"1530"	"T0576"	"9869628494247847080"	"Presentation of a generic model of growth with development of spatial patterns - Discussion upon extension towards genetic systems"	""	""	""	";Alain , Franc"	"1999-03-24"	"en"	"false"	"0"	"0"
"26567"	"T1177"	"12984475774204509669"	"Le Portugal et le défi de la transition énergétique : enjeux et conflits"	"Portugal and the challenge of the energy transition: issues and conflicts"	";Portugal;local geopolitics issues;géopolitique locale;renewable;hydroélectricité;energy transition;énergies renouvelables;transition énergétique;planning protests;conflit d’aménagement;hydroelectricity;wind power;éolie"	"transition énergétique,énergies renouvelables,éolien,hydroélectricité,conflit d’aménagement,géopolitique locale,Portugal"	";Mark , Bailoni;Michel , Deshaies"	"2014-12-19"	"fr"	"true"	"0"	"32"
"635"	"T0181"	"7794779846879981521"	"Paléohydrographie et archéologie de l’espace rural en pays tricastin (France, Drôme) : de l’archéologie aérienne à la télédétection satellitaire"	""	";télédétection;remote sensin"	"télédétection"	";Jean-François , Berger;Thierry , Odiot;Gérard , Chouquer;Cécile , Jung;François , Favory;Ibtissem , Tounsi"	"2000-05-05"	"fr"	"false"	"0"	"9"
"24203"	"T1001"	""	"Professorial patronage and the formation of French geographical knowledge. A bio-bibliographical exploration of one hundred non-metropolitan regional monographs, 1893-1969"	"Professorial patronage and the formation of French geographical knowledge. A bio-bibliographical exploration of one hundred non-metropolitan regional monographs, 1893-1969"	";doctorat;academic geography;patronage;doctorate;thèse;géographie académique;hors-métropole;parrainage;monograph;non-metropolitan;thesi"	"doctorat,géographie académique,hors-métropole,parrainage,thèse"	";Hugh , Clout"	"2011-10-17"	""	"true"	"0"	"179"
"4133"	"T0526"	"8904738583795715269"	"La mobilisation contre Le Pen  entre les deux tours de l’élection présidentielle de 2002 : le sursaut et les fissures"	""	";France;présidence;carte;élection;politiqu"	"élection,France,carte,présidence,politique"	";Jean-Paul , Gosset;Céline , Colange;Michel , Bussi"	"2002-06-13"	"fr"	"false"	"0"	"0"
"22699"	"T0820"	"8247050450354838709"	"A propos du géosystème"	""	""	""	";Yves , Guermond"	"2009-10-05"	"fr"	"false"	"0"	"0"
"26756"	""	"17296586076264187026"	"Emergence, diffusion et déclin d’un réseau de cliniques franchisées en Inde"	"Emergence, diffusion and decline of a network of franchised clinics in India"	";franchisage;spatial diffusion;Inde;diffusion spatiale;healthcare network;réseau de soins;India;franchisin"	"franchisage,réseau de soins,diffusion spatiale,Inde"	";Bertrand , Lefebvre"	"2015-02-19"	"fr"	"true"	"0"	"30"
"3936"	"T0346"	"1580996990975712678"	"Centrality and Land Use : Three Case Studies on the Configurational Hypothesis"	""	";centrality;urban space;grid configuration;centralité;exploitation du sol;espace urbain;configuration du quadrillage;land us"	"espace urbain,exploitation du sol,configuration du quadrillage,centralité"	";Valerio , Cutini"	"2001-03-26"	"en"	"false"	"0"	"16"
"25353"	"T1042"	"5816416974963252682"	"Un automate cellulaire pour expérimenter les effets de la proximité dans le processus d’étalement urbain : le modèle Raumulus"	"A cellular automaton for testing proximity effects on urban sprawl: the Raumulus model"	";proximity;urban growth;cellular automaton;automate cellulaire;proximité;ville;croissance urbaine;cit"	"automate cellulaire,croissance urbaine,proximité,ville"	";Diego , Moreno;Arnaud , Banos;Dominique , Badariotti"	"2012-05-15"	""	"true"	"0"	"53"
"4020"	"T0261"	"12075273365978254220"	"A field-based crop and land use map over Sanjiang plain in Heilongjiang derived from multi-temporal imagery of Landsat7-ETM+"	""	";filtre par parcelle;post-classification;maximum Likelihood classification;Chine;per-field filter;segmentation;classification par maximum de probabilité;CGMS;Chin"	"CGMS,Chine,classification par maximum de probabilité,filtre par parcelle,post-classification,segmentation"	";Pierre , Ozer;Xiufen , Li;Qinghan , Dong;Herman , Eerens"	"2003-09-19"	"en"	"false"	"0"	"6"
"24913"	"T0996"	"9616370006505044944"	"The “Paris Basin”, a metropolitan region"	""	""	""	";Frédéric , Gilli"	"2011-12-22"	"en"	"false"	"0"	"29"
"24767"	"T0945"	"10750278397057582076"	"Cybergeo et la société de consommation"	""	""	""	";Denise , Pumain;Christine , Kosmopoulos"	"2011-11-04"	"fr"	"false"	"0"	"0"
"5565"	"T0305"	"15708269996867241662"	"Ambulantage et métropolisation"	""	";ambulantism;public space;mobilité;métropolisation;ambulantage;espace public;mobilité urbaine;metropolization;mobility;urban mobilit"	"ambulantage,métropolisation,mobilité,mobilité urbaine,espace public"	";Jérôme , Monnet"	"2007-04-21"	"fr"	"false"	"0"	"0"
"814"	""	"15414418585951512000"	"Grison L., 2002<em>, Figures fertiles. Essai sur les figures géographiques dans l´art occidental</em>, Nîmes: Editions Jacqueline Chambon, Collection Rayon Art, 271 p."	""	";structuralisme;oeuvres d´art;herméneutique;géographie;symboliqu"	"géographie,herméneutique,oeuvres d´art,structuralisme,symbolique"	";Olivier , Milhaud"	"2003-06-27"	"fr"	"false"	"0"	"7"
"301"	"T0321"	""	"Des densités aux rugosités. Les modalités instrumentales d’une transposition"	""	""	""	";Jean-Pierre , Peneau"	"1996-04-12"	"fr"	"false"	"0"	"0"
"25200"	"T1038"	""	"Du lieu vu au milieu vécu"	""	";histoire de la culture;toposensibilité;Tibet;géographie littéraire;expérience vécue;paysage urbain;exploratio"	"Tibet,exploration,paysage urbain,expérience vécue,géographie littéraire,histoire de la culture,toposensibilité"	";Samuel , Thévoz"	"2012-03-02"	"fr"	"false"	"0"	"29"
"26749"	""	""	"Sala Pala V., 2013, Discriminations ethniques. Les politiques du logement social en France et au Royaume-Uni, Rennes, Presses Universitaires de Rennes, collection « Res Publica », 302 p."	""	""	""	";Thérèse , Saint-Julien"	"2015-02-17"	"fr"	"false"	"0"	"0"
"5529"	"T0683"	"1273429891071614398"	"La rénovation du Recensement de la Population"	""	";France;recensement;populatio"	"France,population,recensement"	";Michel , Isnard"	"1999-07-15"	"fr"	"false"	"0"	"0"
"23155"	"T0863"	"1351474134111035437"	"Les types de climats en France, une construction spatiale"	"Types of climates on continental France, a spatial construction"	";on line data base;climate typology;cartography;cartographie;quantitative approach;base de données en ligne;typologie des climats;approche quantitativ"	"approche quantitative,base de données en ligne,cartographie,typologie des climats"	";Daniel , Joly;Thierry , Brossard;Pierre , Wavresky;Mohamed , Hilal;Jean , Cavailhes;Hervé , Cardot"	"2010-06-18"	"fr"	"true"	"0"	"23"
"553"	"T0613"	""	"Colloque : 30 ans de sémiologie graphique"	""	""	""	""	"1997-12-12"	"fr"	"false"	"0"	"0"
"592"	"T0547"	""	"Jeux d’échelles, ou quand la quantité change la qualité"	""	""	""	";Denise , Pumain"	"2004-12-12"	"fr"	"false"	"0"	"0"
"785"	"T0557"	"5765147771039625023"	"Le Roux A., 2003, Didactique de la géographie, Presses universitaires de Caen, 268 p."	""	""	""	";Jean-Pierre , Chevalier"	"2004-12-17"	""	"false"	"0"	"0"
"26730"	""	"1819570045680387305"	"Multilevel comparison of large urban systems"	""	";systèmes de villes;BRICS;cities trajectories;trajectoires de villes;Gibrat;urban systems;Zip"	"systèmes de villes,Zipf,Gibrat,trajectoires de villes,BRICS"	";Denise , Pumain;Liliane , Lizzi;François , Delisle;Anne , Bretagnolle;Clémentine , Cottineau;Robin , Cura;Antonio , Ignazzi;Elfie , Swerts;Céline , Vacchiani-Marcuzzo;Solène , Baffi"	"2015-01-17"	"en"	"false"	"0"	"29"
